producto,marca,formato,cantidad,precio,supermercado
Crema protección solar infantil FPS 50+  para pieles sensibles y atópicas,Deliplus,Bote,100 ml,"3,90 €",Mercadona
Crema protección solar infantil FPS 50+  para pieles sensibles y atópicas,Deliplus,Bote,200 ml,"4,80 €",Mercadona
Crema protección solar  FPS 50+,Deliplus,Bote,200 ml,"4,80 €",Mercadona
Crema protección solar  FPS 50+,Deliplus,Bote,100 ml,"3,80 €",Mercadona
Protector solar Sensitive advanced  FPS 50+,Delial,Spray,270 ml,"13,45 €",Mercadona
Protector solar niños bruma Denenes  FPS 50,Ecran,Spray,250 ml,"13,10 €",Mercadona
Protector solar niños Sensitive advanced  FPS 50+,Delial,Spray,270 ml,"13,95 €",Mercadona
Protector solar bruma Sport Aqua  FPS 50,Ecran,Spray,250 ml,"14,10 €",Mercadona
Protector solar protege e hidrataFPS 50+, Nivea ,Bote,400 ml,"16,95 €",Mercadona
Crema protección solar facial  FPS 50+,Deliplus,Bote,50 ml,"6,00 €",Mercadona
Gel protección solar facial anti-edad  FPS 50+,Deliplus,Bote,50 ml,"6,00 €",Mercadona
Protector solar bruma facial  FPS 50,Delial,Spray,75 ml,"8,90 €",Mercadona
Crema facial con color BB cream FPS 50+  tono medio,Delial,Bote,50 ml,"9,90 €",Mercadona
Protector labial  FPS 15,Deliplus,Paquete,1 ud.,"1,50 €",Mercadona
Mousse autobronceadora transparente corporal,Deliplus,Bote,210 ml,"6,50 €",Mercadona
Guante aplicador autobronceador,Deliplus,Paquete,1 ud.,"6,00 €",Mercadona
Toallitas autobronceadoras  monodosis,Deliplus,Caja,6 ud.,"4,00 €",Mercadona
Aftersun leche corporal  hidratante y reparadora,Ecran,Bote,400 ml,"6,75 €",Mercadona
Aftersun gel con aloe vera,Deliplus,Bote,400 ml,"3,50 €",Mercadona
Fluido protección solar facial  FPS50+ super uv,Delial,Bote,40 ml,"12,95 €",Mercadona
Aceite bruma protectora Sunnique  FPS 30,Ecran,Spray,250 ml,"12,40 €",Mercadona
