producto,marca,formato,cantidad,precio,supermercado,categoría,id_producto
Manzana golden,Dia,Bolsa,1 Kg,1.99,Dia,Fruta y verduras,0
Manzana roja,Dia,Bolsa,1 Kg,2.19,Dia,Fruta y verduras,1
Manzana pink lady,Dia,Bandeja,550 g,1.99,Dia,Fruta y verduras,2
Manzana golden,Dia,Granel,1 Kg,2.19,Dia,Fruta y verduras,3
Manzana granny,Dia,Granel,800 g,1.75,Dia,Fruta y verduras,4
Manzana fuji,Dia,Bolsa,1 Kg,2.29,Dia,Fruta y verduras,5
Manzana roja selección,Dia,Granel,1 Kg,2.69,Dia,Fruta y verduras,6
Bebida espirituosa tipo brandy,Gladiador,Botella,1 l,5.99,Dia,Bebidas con alcohol,7
Brandy,Veterano,Botella,1 l,9.35,Dia,Bebidas con alcohol,8
Brandy de Jerez solera reserva,Magno,Botella,70 cl,11.99,Dia,Bebidas con alcohol,9
Brandy de Jerez solera,Gladiador,Botella,70 cl,6.79,Dia,Bebidas con alcohol,10
Brandy,Centenario,Botella,1 l,9.49,Dia,Bebidas con alcohol,11
Brandy de Jerez,Soberano,Botella,70 cl,7.99,Dia,Bebidas con alcohol,12
Brandy,Torres,Botella,  70 cl,10.5,Dia,Bebidas con alcohol,13
Brandy de Jerez solera gran reserva,Alma de magno,Botella,70 cl,16.79,Dia,Bebidas con alcohol,14
Huevos super grandes XL,Hacendado,Paquete,12 ud.,3.25,Mercadona,Huevos,15
Huevos grandes L,Hacendado,Paquete,12 ud.,2.2,Mercadona,Huevos,16
Huevos grandes L,Hacendado,Paquete,6 ud.,1.2,Mercadona,Huevos,17
Huevos medianos M,Hacendado,Paquete,12 ud.,2.0,Mercadona,Huevos,18
Huevos de gallinas camperas,Hacendado,Paquete,12 ud.,2.62,Mercadona,Huevos,19
Huevos de gallinas camperas,Hacendado,Paquete,6 ud.,1.59,Mercadona,Huevos,20
Huevos cocidos,Hacendado,Paquete,6 ud.,1.6,Mercadona,Huevos,21
Huevos de codorniz,Hacendado,Paquete,18 ud.,1.65,Mercadona,Huevos,22
Claras de huevo líquidas pasteurizadas,Hacendado,Botella,1 L,2.6,Mercadona,Huevos,23
Claras de huevo líquidas pasteurizadas,Hacendado,Botella,300 ml,1.55,Mercadona,Huevos,24
Huevos,Hacendado,Paquete,24 ud.,3.8,Mercadona,Huevos,25
Cerveza extra malta,Ramblers,Lata,33 cl,0.53,Dia,Bebidas con alcohol,26
Cerveza tostada,Ramblers,Lata,33 cl,0.49,Dia,Bebidas con alcohol,27
Cerveza de trigo,Ramblers,Botella,50 cl,1.05,Dia,Bebidas con alcohol,28
Cerveza muy suave,Ramblers,Botella,33 cl,0.89,Dia,Bebidas con alcohol,29
Cerveza,Ramblers,Lata,  33 cl,0.45,Dia,Bebidas con alcohol,30
Cerveza doble malta,Voll Damm,Lata,33 cl,0.99,Dia,Bebidas con alcohol,31
Cerveza mexicana,Corona,Botella,35.5 cl,1.5,Dia,Bebidas con alcohol,32
Cerveza reserva,Alhambra,Botella,  4 x 33 cl,5.89,Dia,Bebidas con alcohol,33
Cerveza reserva,Alhambra,Botella,  6 x 225 ml,5.99,Dia,Bebidas con alcohol,34
Cerveza con tequila,Desperados,Botella,33 cl,1.49,Dia,Bebidas con alcohol,35
Cerveza especial blue,Salitos,Botella,33 cl,1.75,Dia,Bebidas con alcohol,36
Cerveza,Franz,Botella,50 cl,1.86,Dia,Bebidas con alcohol,37
Cerveza especial negra,Ramblers,Lata,33 cl,0.53,Dia,Bebidas con alcohol,38
Cerveza de trigo alemana,Paulaner,Botella,50 cl,1.99,Dia,Bebidas con alcohol,39
Cerveza reserva especial,1906,Botella,6 x 33 cl,7.29,Dia,Bebidas con alcohol,40
Cerveza artesana,Ramblers,Botella,33 cl,0.93,Dia,Bebidas con alcohol,41
Cerveza tostada doble lúpulo  Maestra,Mahou,Lata,33 cl,1.0,Dia,Bebidas con alcohol,42
Cerveza rosé,Mahou,Lata,33 cl,0.89,Dia,Bebidas con alcohol,43
Cerveza artesana ipa,Ramblers,Botella,33 cl,1.3,Dia,Bebidas con alcohol,44
Cerveza,Budweiser,Botella,6 x 25 cl,4.69,Dia,Bebidas con alcohol,45
Cerveza,Ambar,Botella,  33 cl,1.49,Dia,Bebidas con alcohol,46
Cerveza,Budweiser,Lata,33 cl,0.95,Dia,Bebidas con alcohol,47
Cerveza tostada doble lúpulo  Maestra pack,Mahou,Frasco,6 x 25 cl,5.55,Dia,Bebidas con alcohol,48
Cerveza ipa,Ambar,Lata,33 cl,1.29,Dia,Bebidas con alcohol,49
Cerveza rubia,Pilsner Urquell,Lata,33 cl,1.39,Dia,Bebidas con alcohol,50
Cerveza morena tostada suavemente,Ambar,Lata,33 cl,0.95,Dia,Bebidas con alcohol,51
Cerveza especial,La rubia,Botella,  33 cl,1.17,Dia,Bebidas con alcohol,52
Cerveza artesanal,Blue moon,Botella,33 cl,1.69,Dia,Bebidas con alcohol,53
Cerveza,Corona,Botella,  33 cl,1.6,Dia,Bebidas con alcohol,54
Cerveza ipa,Arriaca,Lata,33 cl,1.75,Dia,Bebidas con alcohol,55
Cerveza artesana all day ipa,Founders,Lata,33 cl,1.89,Dia,Bebidas con alcohol,56
Cerveza especial pink,Salitos,Botella,33 cl,1.75,Dia,Bebidas con alcohol,57
Cerveza artesana roja,Ramblers,Botella,33 cl,1.05,Dia,Bebidas con alcohol,58
Cerveza extra  Selecta,San Miguel,Botella,33 cl,1.19,Dia,Bebidas con alcohol,59
Cerveza especial extreme,8.6,Lata,50 cl,1.45,Dia,Bebidas con alcohol,60
Cerveza especial original,8.6,Lata,50 cl,1.35,Dia,Bebidas con alcohol,61
Cerveza rubia genuine draft,Miller,Botella,33 cl,1.29,Dia,Bebidas con alcohol,62
Cerveza especial indian ipa,La sagra,Botella,33 cl,1.99,Dia,Bebidas con alcohol,63
Cerveza ipa,Mahou,Lata,33 cl,1.19,Dia,Bebidas con alcohol,64
Cerveza brune,Leffe,Botella,33 cl,2.19,Dia,Bebidas con alcohol,65
Cerveza bourbon  Barrica,Mahou,Botella,33 cl,2.35,Dia,Bebidas con alcohol,66
Cerveza lager dunkel  Maestra,Mahou,Botella,33 cl,1.45,Dia,Bebidas con alcohol,67
Cerveza  Barrica,Mahou,Botella,33 cl,1.99,Dia,Bebidas con alcohol,68
Cerveza tostada doble lúpulo  Maestra,Mahou,Botella,33 cl,1.39,Dia,Bebidas con alcohol,69
Cerveza roja reserva,Alhambra,Botella,4 x 33 cl,5.99,Dia,Bebidas con alcohol,70
Cerveza mexicana,Coronita,Botella,6 x 21 cl,5.69,Dia,Bebidas con alcohol,71
Cerveza,Stella Artois,Botella,33 cl,1.69,Dia,Bebidas con alcohol,72
Cerveza red vintage,1906,Botella,6 x 33 cl,7.55,Dia,Bebidas con alcohol,73
Cerveza doble malta,Voll Damm,Botella,6 x 25 cl,5.49,Dia,Bebidas con alcohol,74
Cerveza especial sin gluten,Ambar,Botella,33 cl,1.29,Dia,Bebidas con alcohol,75
Cerveza extra  Selecta,San Miguel,Lata,33 cl,1.0,Dia,Bebidas con alcohol,76
Cerveza reserva especial,1906,Lata,33 cl,1.09,Dia,Bebidas con alcohol,77
Gazpacho,Al Punto,Brik,1 l,1.95,Dia,"Conservas, caldos y cremas",78
Salmorejo,Al Punto,Brik,1 l,2.39,Dia,"Conservas, caldos y cremas",79
Gazpacho,Al Punto,Brik,3 x 330 ml,2.39,Dia,"Conservas, caldos y cremas",80
Gazpacho suave,Al Punto,Brik,1 l,1.95,Dia,"Conservas, caldos y cremas",81
Muesli extra,Gran Dia,Caja,500 g,1.95,Dia,Cereales y galletas,82
Copos de avena,Gran Dia,Caja,500 g,1.0,Dia,Cereales y galletas,83
Muesli crujiente con chocolate,Gran Dia,Caja,500 g,2.1,Dia,Cereales y galletas,84
Cereales rellenos de leche,Gran Dia,Caja,500 g,2.5,Dia,Cereales y galletas,85
Cereales rellenos con chocolate y avena,Gran Dia,Caja,500 g,2.1,Dia,Cereales y galletas,86
Cereales copos de maíz corn flakes,Gran Dia,Caja,500 g,1.45,Dia,Cereales y galletas,87
"Cereales copos de trigo, arroz y cebada con chocolate negro",Gran Dia,Caja,300 g,1.88,Dia,Cereales y galletas,88
Cereales copos de maíz corn flakes  Corn Flakes,Kellogg's,Caja,500 g,3.0,Dia,Cereales y galletas,89
Cereales de arroz inflado  Choco Krispies,Kellogg's,Caja,420 g,3.55,Dia,Cereales y galletas,90
Cereales de pétalos de trigo y chocolate,Gran Dia,Caja,500 g,1.8,Dia,Cereales y galletas,91
Cereales de trigo inflado con miel,Gran Dia,Caja,500 g,1.95,Dia,Cereales y galletas,92
Cereales integrales con chocolate  Chocapic,Nestlé,Caja,375 g,3.19,Dia,Cereales y galletas,93
Cereales copos de arroz y trigo integral cubiertos de chocolate,Gran Dia,Caja,300 g,1.88,Dia,Cereales y galletas,94
Barritas de cereales con chocolate con leche,Gran Dia,Caja,150 g,1.49,Dia,Cereales y galletas,95
Cereales de arroz inflado con chocolate,Gran Dia,Caja,500 g,2.1,Dia,Cereales y galletas,96
Cereales copos de arroz y trigo integral con frutos rojos,Gran Dia,Caja,300 g,1.88,Dia,Cereales y galletas,97
Barritas de cereales plátano y chocolate con leche,Gran Dia,Caja,150 g,1.49,Dia,Cereales y galletas,98
Cereales rellenos de cacao y avellana,Gran Dia,Caja,500 g,2.1,Dia,Cereales y galletas,99
Cereales copos de maíz tostados  Frosties,Kellogg's,Caja,400 g,3.99,Dia,Cereales y galletas,100
Cereales de bolas con chocolate,Gran Dia,Caja,500 g,2.15,Dia,Cereales y galletas,101
Barritas de cereales con chocolate nesquik,Nestlé,Caja,150 g,2.99,Dia,Cereales y galletas,102
Cereales integrales con chocolate negro  Fitness,Nestlé,Caja,375 g,3.49,Dia,Cereales y galletas,103
Barritas de cereales con chocolate con leche,Corny,Caja,150 g,2.49,Dia,Cereales y galletas,104
Cereales de trigo y maíz tostados con pepitas al cacao  Cookie Crisp,Nestlé,Caja,375 g,3.59,Dia,Cereales y galletas,105
"Cereales copos de arroz, trigo integral y cebada",Gran Dia,Caja,500 g,2.09,Dia,Cereales y galletas,106
Cereales copos de trigo integral y arroz con virutas de chocolate con leche  Special K,Kellogg's,Caja,335 g,3.45,Dia,Cereales y galletas,107
Barritas de cereales con chocolate negro  Special K,Kellogg's,Caja,129 g,3.7,Dia,Cereales y galletas,108
Cereales integrales con chocolate nesquik,Nesquik,Caja,375 g,3.69,Dia,Cereales y galletas,109
Cereales copos de trigo integral fibre flakes,Gran Dia,Caja,375 g,1.79,Dia,Cereales y galletas,110
Barritas de cereales chocolateadas  Choco Krispies,Kellogg's,Caja,120 g,3.35,Dia,Cereales y galletas,111
Barritas de cereales con avellanas,Gran Dia,Caja,150 g,1.49,Dia,Cereales y galletas,112
"Barritas de cereales con albaricoque, manzana y uvas pasas",Gran Dia,Caja,150 g,1.49,Dia,Cereales y galletas,113
Cereales integrales con chocolate  Fitness,Nestlé,Caja,375 g,3.49,Dia,Cereales y galletas,114
Cereales con frutas rojas  Special K,Kellogg's,Caja,300 g,4.19,Dia,Cereales y galletas,115
Cereales de copos de maíz con azúcar,Gran Dia,Caja,500 g,2.05,Dia,Cereales y galletas,116
Muesli crujiente con frutas,Gran Dia,Caja,500 g,2.1,Dia,Cereales y galletas,117
Muesli con frutas,Gran Dia,Bolsa,1 Kg,2.3,Dia,Cereales y galletas,118
Cereales de bolas de maíz con miel,Gran Dia,Caja,500 g,2.35,Dia,Cereales y galletas,119
Cereales copos de trigo con fruta y fibra,Gran Dia,Caja,500 g,2.55,Dia,Cereales y galletas,120
Barritas de cereales de bizcochitos con fruta y fibra  All-Bran,Kellogg's,Caja,240 g,3.99,Dia,Cereales y galletas,121
Surtido sushi  grande,Bento,Bandeja,310 g,10.75,Mercadona,Marisco y pescado,122
Surtido sushi  pequeño,Bento,Bandeja,160 g,6.75,Mercadona,Marisco y pescado,123
Surtido sushi  mix,Bento,Bandeja,350 g,8.75,Mercadona,Marisco y pescado,124
Noodles Yakisoba con carne y verduras,Hacendado,Bol,300 g,4.5,Mercadona,Marisco y pescado,125
Poke salmón,Hacendado,Bol,400 g,5.5,Mercadona,Marisco y pescado,126
Pollo teriyaki,Hacendado,Bol,300 g,5.0,Mercadona,Marisco y pescado,127
Limones,Dia,Malla,750 g,1.29,Dia,Fruta y verduras,128
Limón,Dia,Selección,1 unidad,0.49,Dia,Fruta y verduras,129
Limón bio,Dia,Malla,500 g,0.99,Dia,Fruta y verduras,130
Pomelo,Dia,Selección,1 unidad,0.59,Dia,Fruta y verduras,131
Vino tinto,Castillo de Velasco,Brik,1 l,1.05,Dia,Bebidas con alcohol,132
Vino tinto crianza D.O. Valdepeñas,Viña Albalí,Botella,75 cl,2.95,Dia,Bebidas con alcohol,133
Vino tinto crianza D.O. Castilla La Mancha,Ribera de Algodor,Botella,75 cl,1.65,Dia,Bebidas con alcohol,134
Vino tinto  garrafa,Castillo de Velasco,Frasco,2 l,2.6,Dia,Bebidas con alcohol,135
Vino tinto joven D.O. La Mancha,Ribera de Algodor,Botella,75 cl,1.45,Dia,Bebidas con alcohol,136
Vino tinto roble D.O. Toro,Campo curero,Botella,75 cl,2.99,Dia,Bebidas con alcohol,137
Vino tinto roble D.O. Ribera del Duero,Arco del Sol,Botella,75 cl,3.65,Dia,Bebidas con alcohol,138
Vino tinto crianza D.O. Rioja,Cvne,Botella,75 cl,6.95,Dia,Bebidas con alcohol,139
Vino tinto roble D.O.  Altos de Tamarón,Ribera del Duero,Botella,75 cl,6.4,Dia,Bebidas con alcohol,140
Vino tinto,Carta de plata,Botella,75 cl,3.59,Dia,Bebidas con alcohol,141
Vino tinto,Castillo de Velasco,Botella,75 cl,1.29,Dia,Bebidas con alcohol,142
Vino tinto  garrafa,Valle rojo,Frasco,5 l,5.2,Dia,Bebidas con alcohol,143
Vino tinto reserva D.O. Valdepeñas,Viña Albalí,Botella,75 cl,3.69,Dia,Bebidas con alcohol,144
Vino tinto joven D.O. Rioja  Rivero,Faustino,Botella,75 cl,3.99,Dia,Bebidas con alcohol,145
Vino tinto reserva  Rivero,Faustino,Botella,75 cl,2.09,Dia,Bebidas con alcohol,146
Vino tinto D.O. Rioja,Señorío de Ondas,Botella,75 cl,2.45,Dia,Bebidas con alcohol,147
Vino tinto crianza D.O. Rioja,Castillo de Haro,Botella,75 cl,4.19,Dia,Bebidas con alcohol,148
Vino tinto roble D.O. Ribera del Duero,Heredad baran,Botella,75 cl,4.95,Dia,Bebidas con alcohol,149
Vino tinto sirah,Señorío de Ayerbe,Botella,75 cl,2.85,Dia,Bebidas con alcohol,150
Vino tinto,Habla de la tierra,Botella,75 cl,8.25,Dia,Bebidas con alcohol,151
Vino tinto crianza D.O. Madrid,Puerta de Alcalá,Botella,75 cl,4.45,Dia,Bebidas con alcohol,152
Vino tinto gran reserva D.O. Valdepeñas,Viña Albalí,Botella,75 cl,4.49,Dia,Bebidas con alcohol,153
Vino tinto crianza D.O. Ribera del Duero,Altos del Tamarón,Botella,75 cl,7.45,Dia,Bebidas con alcohol,154
Vino tinto D.O.  Viña Mayor,Ribera del Duero,Botella,75 cl,7.75,Dia,Bebidas con alcohol,155
Vino tinto,Cumbre de Gredos,Brik,1 l,1.69,Dia,Bebidas con alcohol,156
Vino tinto D.O. Valdepeñas,Molinos,Botella,75 cl,2.35,Dia,Bebidas con alcohol,157
Vino tinto crianza D.O. Rioja,Lagunilla,Botella,75 cl,7.49,Dia,Bebidas con alcohol,158
Vino tinto D.O. Tempranillo Altos de Tamarón,Marca no encontrada,Botella,75 cl,2.99,Dia,Bebidas con alcohol,159
Vino tinto D.O. Madrid,Puerta de Alcalá,Botella,75 cl,5.75,Dia,Bebidas con alcohol,160
Vino tinto crianza D.O. Rioja,Campo viejo,Botella,75 cl,5.77,Dia,Bebidas con alcohol,161
Vino tinto reserva D.O. Rioja,Señorío de Ondas,Botella,75 cl,4.1,Dia,Bebidas con alcohol,162
Vino tinto CVC D.O. Rioja  VII,Faustino,Botella,75 cl,3.99,Dia,Bebidas con alcohol,163
Vino tinto de la tierra de Extremadura   baginbox,Viña Tabora,Frasco,3 l,4.99,Dia,Bebidas con alcohol,164
Vino tinto D.O. Madrid,Puerta de Alcalá,Botella,75 cl,3.09,Dia,Bebidas con alcohol,165
Vino tinto D.O. Somontano,Viñas del Vero,Botella,75 cl,6.1,Dia,Bebidas con alcohol,166
Vino tinto crianza D.O Rioja,Señorío de Ondas,Botella,75 cl,3.25,Dia,Bebidas con alcohol,167
Vino tinto crianza D.O. Rioja,Beronia,Botella,75 cl,8.99,Dia,Bebidas con alcohol,168
Vino tinto,Don Simón,Brik,1 l,1.6,Dia,Bebidas con alcohol,169
Vino tinto crianza D.O. Rioja,Ederra,Botella,75 cl,6.99,Dia,Bebidas con alcohol,170
Vino tinto cabernet sauvignon IGP,Señorío de Ayerbe,Botella,75 cl,2.9,Dia,Bebidas con alcohol,171
Vino tinto crianza D.O. Navarra,Viña Ardanche,Botella,75 cl,2.49,Dia,Bebidas con alcohol,172
Vino tinto joven D.O. Rioja,Castillo de Haro,Botella,75 cl,3.29,Dia,Bebidas con alcohol,173
Vino tinto,Mucho mas,Botella,75 cl,6.49,Dia,Bebidas con alcohol,174
Vino tinto reserva D.O. La Mancha,Estola,Botella,75 cl,3.89,Dia,Bebidas con alcohol,175
Vino tinto de Ribera del Queiles,Garnacha salvaje moncayo,Botella,75 cl,8.09,Dia,Bebidas con alcohol,176
Vino tinto crianza D.O. Rioja,López de Haro,Botella,75 cl,7.95,Dia,Bebidas con alcohol,177
Vino tinto D.O. Toro,Matsu,Botella,75 cl,7.99,Dia,Bebidas con alcohol,178
Vino tinto roble D.O.  Valderivero,Ribera del Duero,Botella,75 cl,6.99,Dia,Bebidas con alcohol,179
Vino tinto joven D.O.  Valderivero,Ribera del Duero,Botella,75 cl,5.9,Dia,Bebidas con alcohol,180
Vino tinto mencia D.O. Monterrei,Mourama,Botella,75 cl,4.59,Dia,Bebidas con alcohol,181
Vino tinto crianza D.O. Ribera del Duero,Heredad baran,Botella,75 cl,6.29,Dia,Bebidas con alcohol,182
Vino tinto reserva D.O. Cariñena,Geraldino,Botella,75 cl,2.79,Dia,Bebidas con alcohol,183
Vino tinto crianza D.O. Cariñena,Geraldino,Botella,75 cl,2.19,Dia,Bebidas con alcohol,184
Vino tinto ecológico D.O. Jumilla,Sismicus,Botella,75 cl,2.99,Dia,Bebidas con alcohol,185
Vino tinto joven D.O. Jumilla,Sismicus,Botella,75 cl,2.59,Dia,Bebidas con alcohol,186
Vino tinto reserva D.O. La Mancha,Ribera de Algodor,Botella,75 cl,2.29,Dia,Bebidas con alcohol,187
Vino tinto tempranillo,Abstractio,Botella,75 cl,2.85,Dia,Bebidas con alcohol,188
Vino tinto reserva D.O. Utiel Requena,Mirandoli,Botella,75 cl,2.39,Dia,Bebidas con alcohol,189
Vino tinto crianza D.O. Utiel Requena,Mirandoli,Botella,75 cl,2.29,Dia,Bebidas con alcohol,190
Vino tinto tempranillo syrah,Pinta en Copas,Botella,75 cl,1.99,Dia,Bebidas con alcohol,191
Vino tinto reserva D.O. Ribera del Duero,Arco del Sol,Botella,75 cl,5.99,Dia,Bebidas con alcohol,192
Vino tinto crianza D.O. Ribera del Duero,Arco del Sol,Botella,75 cl,4.49,Dia,Bebidas con alcohol,193
Vino tinto crianza D.O. Valdepeñas,Viña Danza,Botella,75 cl,2.19,Dia,Bebidas con alcohol,194
Vino tinto joven D.O. Valdepeñas,Viña Danza,Botella,75 cl,1.79,Dia,Bebidas con alcohol,195
Vino tinto reserva D.O. Rioja,Castillo de Haro,Botella,75 cl,6.99,Dia,Bebidas con alcohol,196
Vino tinto joven madurado D.O. Rioja,Castillo de Haro,Botella,75 cl,3.89,Dia,Bebidas con alcohol,197
Vino tinto reserva D.O. Valdepeñas,Viña Danza,Botella,75 cl,2.69,Dia,Bebidas con alcohol,198
Vino tinto viñas viejas D.O Toro,Campo curero,Botella,75 cl,5.09,Dia,Bebidas con alcohol,199
Vino tinto D.O Rioja,Berberana,Botella,750 ml,7.29,Dia,Bebidas con alcohol,200
Vino tinto do cádiz,Finca Moncloa,Botella,75 cl,16.25,Dia,Bebidas con alcohol,201
Vino tinto,Mayor de Castilla,Botella,75 cl,3.3,Dia,Bebidas con alcohol,202
Vino tinto merlot,Señorío de Ayerbe,Botella,75 cl,2.85,Dia,Bebidas con alcohol,203
Vino tinto gran reserva D.O. Rioja,Señorío de Ondas,Botella,75 cl,7.99,Dia,Bebidas con alcohol,204
Vino tinto D.O. Rioja,Beronia,Botella,75 cl,16.25,Dia,Bebidas con alcohol,205
Vino tinto D.O. Ribera del Duero,Celeste,Botella,75 cl,9.35,Dia,Bebidas con alcohol,206
Vino tinto de la tierra de Castila,Berberana,Botella,75 cl,4.89,Dia,Bebidas con alcohol,207
Vino tinto D.O. Penedés,Solell de Flix,Botella,75 cl,2.79,Dia,Bebidas con alcohol,208
Vino tinto reserva D.O. Rioja,Viña Pomal,Botella,75 cl,14.95,Dia,Bebidas con alcohol,209
Vino tinto crianza D.O. Rioja,Glorioso,Botella,75 cl,7.95,Dia,Bebidas con alcohol,210
Vino tinto crianza D.O. Ribera del Duero,Matarromera,Botella,75 cl,24.59,Dia,Bebidas con alcohol,211
Vino tinto roble D.O.,Ribera del Duero,Botella,75 cl,9.65,Dia,Bebidas con alcohol,212
Vino tinto D.O. Toro,Bajoz,Botella,75 cl,5.25,Dia,Bebidas con alcohol,213
Vino tinto gran reserva D.O. Rioja,Faustino,Botella,75 cl,19.99,Dia,Bebidas con alcohol,214
Vino tinto crianza D.O. Rioja,Azpilicueta,Botella,75 cl,8.75,Dia,Bebidas con alcohol,215
Vino tinto roble D.O. Ribera del Duero,Legaris,Botella,75 cl,8.95,Dia,Bebidas con alcohol,216
Vino tinto crianza D.O. Ribera del Duero,Protos,Botella,75 cl,19.95,Dia,Bebidas con alcohol,217
Vino tinto crianza D.O Rioja,Ramón Bilbao,Botella,75 cl,9.99,Dia,Bebidas con alcohol,218
Vino tinto crianza D.O. Valdepeñas,Señorío de Los Llanos,Botella,75 cl,2.99,Dia,Bebidas con alcohol,219
Vino tinto reserva D.O. Ribera del Duero,Altos del Tamarón,Botella,75 cl,9.95,Dia,Bebidas con alcohol,220
Vino tinto,Federico Paternina,Botella,  75 cl,6.79,Dia,Bebidas con alcohol,221
Vino tinto reserva D.O. Rioja,Coto de Imaz,Botella,75 cl,7.95,Dia,Bebidas con alcohol,222
Vino tinto D.O. Campo de Borja,Borsao,Botella,75 cl,2.99,Dia,Bebidas con alcohol,223
Vino tinto roble D.O. Ribera del Duero,Protos,Botella,75 cl,9.5,Dia,Bebidas con alcohol,224
Vino tinto D.O. Navarra,Viña Ardanche,Botella,75 cl,1.99,Dia,Bebidas con alcohol,225
Vino tinto crianza D.O. Rioja,Marqués de Caceres,Botella,75 cl,7.9,Dia,Bebidas con alcohol,226
Vino tinto CVC D.O. Rioja,Campo viejo,Botella,75 cl,4.27,Dia,Bebidas con alcohol,227
Vino tinto D.O. Toro,Bajoz,Botella,75 cl,3.69,Dia,Bebidas con alcohol,228
Vino tinto crianza do rioja,Antaño,Botella,75 cl,4.99,Dia,Bebidas con alcohol,229
Vino tinto roble D.O. Ribera del Duero,Mayor de Castilla,Botella,75 cl,6.49,Dia,Bebidas con alcohol,230
Vino tinto crianza D.O. Rioja  Rivero,Faustino,Botella,75 cl,5.75,Dia,Bebidas con alcohol,231
Vino tinto D.O. Rioja,Castillo de Albai,Botella,75 cl,2.78,Dia,Bebidas con alcohol,232
Vino tinto D.O. Cataluña,Sangre toro,Botella,75 cl,5.39,Dia,Bebidas con alcohol,233
Vino tinto crianza D.O. Rioja,El coto,Botella,75 cl,5.95,Dia,Bebidas con alcohol,234
Aguacate,Dia,Bandeja,450 g,1.69,Dia,Fruta y verduras,235
Kiwi,Dia,Bandeja,700 g,2.29,Dia,Fruta y verduras,236
Mango,Dia,Bandeja,650 g,2.59,Dia,Fruta y verduras,237
Guacamole,Al Punto Dia,Tarrina,200 g,1.69,Dia,Fruta y verduras,238
Aguacate,Dia,Granel,750 g,3.74,Dia,Fruta y verduras,239
Kiwi,Zespri,Bandeja,500 g,2.99,Dia,Fruta y verduras,240
Coco troceado bio,Dia,Bolsa,56 g,0.95,Dia,Fruta y verduras,241
Kiwi,Dia,Selección,1 unidad,0.55,Dia,Fruta y verduras,242
Piña gold premium unidad aprox.,Dia,Unidad,2 Kg,4.38,Dia,Fruta y verduras,243
Mango,Dia,Unidad,1 unidad,1.99,Dia,Fruta y verduras,244
Pulpa aguacate,Al Punto Dia,Tarrina,125 g,1.45,Dia,Fruta y verduras,245
Aguacate bio,Dia,Bandeja,400 g,2.79,Dia,Fruta y verduras,246
Guacamole,Al Punto Dia,Tarrina,400 g,2.95,Dia,Fruta y verduras,247
Piña Baby,Dia,Unidad,1 unidad,2.0,Dia,Fruta y verduras,248
Filetes de anchoa en aceite de girasol,Hacendado,Filetes,3 bandejas x 29 g,2.1,Mercadona,"Conservas, caldos y cremas",249
Boquerones en vinagre  en aceite de girasol,Hacendado,Bandeja,80 g (60 g escurrido),1.75,Mercadona,"Conservas, caldos y cremas",250
Boquerones al vinagre  en aceite de girasol,Hacendado,Tarrina,330 g (265 g escurrido),5.8,Mercadona,"Conservas, caldos y cremas",251
Filetes de anchoa en aceite de oliva,Hacendado,Lata,42 g (29 g escurrido),1.25,Mercadona,"Conservas, caldos y cremas",252
Filetes de anchoa en aceite de oliva,Hacendado,Filetes,3 bandejas x 29 g,3.05,Mercadona,"Conservas, caldos y cremas",253
Filetes de sardina anchoada  en aceite de girasol,Hacendado,Bandeja,80 g (60 g escurrido),1.6,Mercadona,"Conservas, caldos y cremas",254
Migas de bacalao desaladas,Hacendado,Bandeja,300 g,6.55,Mercadona,Marisco y pescado,255
Filetes de sardina marinada  en aceite de oliva virgen extra,Hacendado,Bandeja,80 g (50 g escurrido),1.4,Mercadona,Marisco y pescado,256
Sucedáneo de caviar negro,Ubago Caviartic,Tarro,75 g,1.85,Mercadona,Marisco y pescado,257
Filetes de anchoa en aceite de oliva,Hacendado,Bandeja,140 g (110 g escurrido),6.7,Mercadona,"Conservas, caldos y cremas",258
Filetes de anchoa en aceite de oliva,Hacendado,Lata,74 g (50 g escurrido),3.75,Mercadona,"Conservas, caldos y cremas",259
Mojama de atún superior en taco  seca salada,Hacendado,Paquete,200 g aprox.,8.0,Mercadona,Marisco y pescado,260
Boquerones aliñados,Hacendado,Bandeja,80 g (60 g escurrido),1.8,Mercadona,Marisco y pescado,261
Migas de bacalao saladas,Hacendado,Bandeja,250 g,5.55,Mercadona,Marisco y pescado,262
Trozos de bacalao salado,Hacendado,Paquete,400 g,4.55,Mercadona,Marisco y pescado,263
Hoja de bacalao,Hacendado,Paquete,800 g aprox.,13.92,Mercadona,Congelados,264
Salmón ahumado,Hacendado,Paquete,100 g aprox.,3.8,Mercadona,Marisco y pescado,265
Salmón ahumado,Hacendado,Filetes,2 paquetes x 150 g,10.8,Mercadona,Marisco y pescado,266
Bacalao ahumado  en aceite de girasol,Hacendado,Bandeja,110 g (80 g escurrido),3.2,Mercadona,Marisco y pescado,267
Salmón marinado,Hacendado,Paquete,80 g,3.5,Mercadona,Marisco y pescado,268
Filetes de sardina ahumada  en aceite de girasol,Hacendado,Bandeja,85 g (65 g escurrido),2.0,Mercadona,Marisco y pescado,269
Taquitos de salmón ahumado,Hacendado,Paquete,100 g,3.8,Mercadona,Marisco y pescado,270
Whisky,Dyc,Botella,1 l,15.25,Dia,Bebidas con alcohol,271
Ron añejo,Barceló,Botella,70 cl,15.45,Dia,Bebidas con alcohol,272
Whisky,Ballantines,Botella,70 cl,12.95,Dia,Bebidas con alcohol,273
Ron añejo,Brugal,Botella,70 cl,15.7,Dia,Bebidas con alcohol,274
Whisky,J&b,Botella,70 cl,13.49,Dia,Bebidas con alcohol,275
Ron añejo,Velero,Botella,70 cl,5.95,Dia,Bebidas con alcohol,276
Ron añejo,Negrita,Botella,50 cl,6.99,Dia,Bebidas con alcohol,277
Whisky,Burned barrel,Botella,70 cl,5.99,Dia,Bebidas con alcohol,278
Whisky red label,Johnnie Walker,Botella,70 cl,15.99,Dia,Bebidas con alcohol,279
Whisky escocés,Douregal,Botella,  70 cl,6.0,Dia,Bebidas con alcohol,280
Ron dominicano viejo,Velero,Botella,70 cl,8.69,Dia,Bebidas con alcohol,281
Whisky black label,Johnnie Walker,Botella,70 cl,29.99,Dia,Bebidas con alcohol,282
Whisky white label,Dewars,Botella,70 cl,13.49,Dia,Bebidas con alcohol,283
Whisky tenessee,Jack Daniel's,Botella,70 cl,23.25,Dia,Bebidas con alcohol,284
Ron blanco superior,Bacardi,Botella,70 cl,13.99,Dia,Bebidas con alcohol,285
Ron de coco,Malibú,Botella,70 cl,12.59,Dia,Bebidas con alcohol,286
Ron añejo,Cacique,Botella,70 cl,14.49,Dia,Bebidas con alcohol,287
Whisky,Dyc,Botella,  70 cl,14.09,Dia,Bebidas con alcohol,288
Whisky,William Lawson's,Botella,70 cl,9.99,Dia,Bebidas con alcohol,289
Ron blanco,Velero,Botella,70 cl,5.25,Dia,Bebidas con alcohol,290
Whisky bourbon,Jim Beam,Botella,70 cl,15.45,Dia,Bebidas con alcohol,291
Whisky,The singleton,Botella,  70 cl,29.99,Dia,Bebidas con alcohol,292
Whisky japanese smooth,Dewars,Botella,70 cl,17.99,Dia,Bebidas con alcohol,293
Whisky,Seagram's,Botella,70 cl,15.39,Dia,Bebidas con alcohol,294
Whisky,Douregal,Botella,  70 cl,8.99,Dia,Bebidas con alcohol,295
Whisky,Fireball,Botella,70 cl,14.49,Dia,Bebidas con alcohol,296
Mojito,Caribica,Botella,70 cl,4.99,Dia,Bebidas con alcohol,297
Whisky escocés blended,Ballantines,Botella,  70 cl,20.99,Dia,Bebidas con alcohol,298
Whisky americano,Wordens,Botella,70 cl,9.99,Dia,Bebidas con alcohol,299
Whisky Tennessee honey,Jack Daniel's,Botella,70 cl,23.25,Dia,Bebidas con alcohol,300
Ron añejo,Santa Teresa,Botella,70 cl,17.39,Dia,Bebidas con alcohol,301
Whisky,Passport,Botella,70 cl,11.99,Dia,Bebidas con alcohol,302
Whisky,Chivas,Botella,  70 cl,29.99,Dia,Bebidas con alcohol,303
Pera conferencia,Dia,Bandeja,1 Kg,2.19,Dia,Fruta y verduras,304
Pera ercolini,Dia,Bandeja,500 g,1.79,Dia,Fruta y verduras,305
Pera Rincón de Soto D.O.P.,Dia,Granel,800 g,2.23,Dia,Fruta y verduras,306
Preparado de paella y sopa  ultracongelado,Hacendado,Paquete,685 g escurrido,4.1,Mercadona,Congelados,307
Arreglo para paella de marisco,Hacendado,Bandeja,850 g aprox.,8.44,Mercadona,Congelados,308
Gambón congelado,Hacendado,Granel,150 g aprox.,1.49,Mercadona,Congelados,309
Gambón grande congelado,Hacendado,Caja,2 kg,17.9,Mercadona,Congelados,310
