producto,marca,formato,cantidad,precio,supermercado,categoría,id_producto
Chocolate blanco con relleno de galleta filipinos  Extrafino,Nestlé,Tableta,84 g,1.25,Dia,"Miel, caramelos y chocolate",2651
Barrita de chocolate caramelo y galleta,Temptation de Dia,Bolsa,290 g,2.25,Dia,"Miel, caramelos y chocolate",2652
Chocolate con leche,Dolca,Tableta,100 g,1.05,Dia,"Miel, caramelos y chocolate",2653
Cacahuetes cubiertos de chocolate de colores,Temptation de Dia,Bolsa,180 g,1.75,Dia,"Miel, caramelos y chocolate",2654
Chocolate con leche y avellanas,Temptation de Dia,Tableta,150 g,1.15,Dia,"Miel, caramelos y chocolate",2655
Mini huevos de chocolate rellenos de crema leche y avellana,Temptation de Dia,Bolsa,150 g,2.5,Dia,"Miel, caramelos y chocolate",2656
Chocolate con leche relleno con caramelo y avellanas,Milka,Tableta,300 g,3.95,Dia,"Miel, caramelos y chocolate",2657
Bombones rellenos de coco y almendra  Raffaello,Ferrero,Caja,150 g,3.85,Dia,"Miel, caramelos y chocolate",2658
Huevo de chocolate con sorpresa joy,Kinder,Tableta,20 g,1.4,Dia,"Miel, caramelos y chocolate",2659
Huevos de chocolate con sorpresa 3 unidades,Kinder,Caja,60 g,3.49,Dia,"Miel, caramelos y chocolate",2660
Chocolate con leche,Nesquik,Tableta,100 g,1.49,Dia,"Miel, caramelos y chocolate",2661
Chocolate con leche con avellanas,Milka,Tableta,270 g,3.95,Dia,"Miel, caramelos y chocolate",2662
Bolitas de chocolate rellenas de leche malteada,Maltesers,Bolsa,175 g,3.59,Dia,"Miel, caramelos y chocolate",2663
Chocolate con leche  Extrafino,Nestlé,Tableta,270 g,2.79,Dia,"Miel, caramelos y chocolate",2664
Chocolate con leche relleno de caramelo,Milka,Tableta,100 g,1.55,Dia,"Miel, caramelos y chocolate",2665
Barritas de chocolate rellenas de caramelo y galleta,Twix,Bolsa,50 g,1.39,Dia,"Miel, caramelos y chocolate",2666
Bolas de chocolate con leche chocobolas  Extrafino,Nestlé,Tableta,140 g,2.59,Dia,"Miel, caramelos y chocolate",2667
Chocolate negro con naranja  Excellence,Lindt,Tableta,100 g,3.25,Dia,"Miel, caramelos y chocolate",2668
Chocolate con leche suizo con miel y almendras,Toblerone,Tableta,3 x 50 g,3.25,Dia,"Miel, caramelos y chocolate",2669
Chocolate con leche milkinis,Milka,Bolsa,87.5 g,1.4,Dia,"Miel, caramelos y chocolate",2670
Chocolate con leche,Milka,Tableta,270 g,2.85,Dia,"Miel, caramelos y chocolate",2671
Huevos de chocolate relleno de leche y avellanas,Kinder,Bolsa,200 g,3.99,Dia,"Miel, caramelos y chocolate",2672
Huevo de chocolate con sorpresa,Kinder,Tableta,20 g,1.3,Dia,"Miel, caramelos y chocolate",2673
Barritas de chocolate con leche y avellanas,Kinder,Bolsa,43 g,1.29,Dia,"Miel, caramelos y chocolate",2674
Barritas de chocolate y galleta rellena de caramelo,Twix,Bolsa,150 g,2.79,Dia,"Miel, caramelos y chocolate",2675
Chocolate con leche y almendras enteras,Temptation de Dia,Tableta,200 g,1.53,Dia,"Miel, caramelos y chocolate",2676
Huevo de chocolate con sorpresa,Temptation de Dia,Caja,60 g,1.65,Dia,"Miel, caramelos y chocolate",2677
Barritas de chocolate  turrón y caramelo,Temptation de Dia,Bolsa,200 g,1.75,Dia,"Miel, caramelos y chocolate",2678
Paraguas de chocolate,Mauri,Bolsa,50 g,2.69,Dia,"Miel, caramelos y chocolate",2679
Chocolate con leche relleno de galleta y caramelo  Extrafino,Nestlé,Tableta,87 g,1.25,Dia,"Miel, caramelos y chocolate",2680
Mini barritas de galleta recubiertas de chocolate,Kit Kat,Bolsa,200 g,2.79,Dia,"Miel, caramelos y chocolate",2681
Chocolate con leche con relleno cremoso y galletas María  Extrafino,Nestlé,Tableta,83 g,1.25,Dia,"Miel, caramelos y chocolate",2682
Chocolate con leche sin lactosa,Trapa,Tableta,90 g,1.49,Dia,"Miel, caramelos y chocolate",2683
Galletas cubiertas de chocolate con leche,Conguitos,Bolsa,120 g,1.69,Dia,"Miel, caramelos y chocolate",2684
Mini barritas de chocolate y galleta rellena de caramelo,Twix,Bolsa,227 g,3.69,Dia,"Miel, caramelos y chocolate",2685
Mini barritas de galleta recubiertas de chocolate blanco,Kit Kat,Bolsa,146 g,2.79,Dia,"Miel, caramelos y chocolate",2686
Chocolate negro 52% cacao,Lindt,Tableta,100 g,1.79,Dia,"Miel, caramelos y chocolate",2687
Chocolate con leche crispy,Lindt,Tableta,100 g,1.79,Dia,"Miel, caramelos y chocolate",2688
Chocolate con leche,Lindt,Tableta,100 g,1.79,Dia,"Miel, caramelos y chocolate",2689
Mini barritas de chocolate con caramelo y cacahuetes,Snickers,Bolsa,227 g,3.69,Dia,"Miel, caramelos y chocolate",2690
Chocolate negro 100% cacao,Trapa,Tableta,80 g,1.9,Dia,"Miel, caramelos y chocolate",2691
Chocolate con leche y almendras 0% azúcares añadidos,Trapa,Tableta,100 g,1.75,Dia,"Miel, caramelos y chocolate",2692
Figuritas de chocolate con leche y galleta  Jungly,Nestlé,Bolsa,124 g,3.49,Dia,"Miel, caramelos y chocolate",2693
Chocolate con leche para repostería,Dr. Oetker,Bolsa,150 g,3.59,Dia,"Miel, caramelos y chocolate",2694
Chocolate con leche con relleno sabor dulce de leche  Extrafino,Nestlé,Tableta,83 g,1.25,Dia,"Miel, caramelos y chocolate",2695
Bombones de chocolate negro 70% cacao  Dark,Nestlé,Bolsa,165 g,4.49,Dia,"Miel, caramelos y chocolate",2696
Chocolate con leche con relleno cremoso y trocitos de galleta Dinosaurus,Nestlé,Tableta,84 g,1.25,Dia,"Miel, caramelos y chocolate",2697
Chocolate con leche con relleno cremoso y trocitos de galleta Tosta Rica  Extrafino,Nestlé,Tableta,84 g,1.25,Dia,"Miel, caramelos y chocolate",2698
Chocolate negro con sabor naranja  Dark,Nestlé,Tableta,120 g,2.29,Dia,"Miel, caramelos y chocolate",2699
Bombones rellenos de cereza al licor,Trapa,Bolsa,120 g,2.35,Dia,"Miel, caramelos y chocolate",2700
Surtido de bombones seducción,Trapa,Bolsa,56 g,1.3,Dia,"Miel, caramelos y chocolate",2701
Chocolate con almendras enteras,Milka,Tableta,300 g,3.79,Dia,"Miel, caramelos y chocolate",2702
Barritas de chocolate y galleta  Jungly,Nestlé,Bolsa,102 g,1.69,Dia,"Miel, caramelos y chocolate",2703
Barquillo relleno de praliné y chocolate,Knoppers,Bolsa,40 g,1.1,Dia,"Miel, caramelos y chocolate",2704
Barquillos rellenos de crema con leche y cacao,Knoppers,Bolsa,75 g,1.49,Dia,"Miel, caramelos y chocolate",2705
Bombones sublimes 0% azúcares añadidos,Trapa,Caja,155 g,3.8,Dia,"Miel, caramelos y chocolate",2706
Bombones sublimes,Trapa,Caja,200 g,3.8,Dia,"Miel, caramelos y chocolate",2707
Barritas de chocolate con leche con galleta noir,Trapa,Bolsa,105 g,1.85,Dia,"Miel, caramelos y chocolate",2708
Chocolate negro 70% con almendras,Trapa,Tableta,175 g,2.49,Dia,"Miel, caramelos y chocolate",2709
Chocolate negro con almendras,Trapa,Tableta,100 g,1.85,Dia,"Miel, caramelos y chocolate",2710
Chocolate blanco sin azúcar añadido,Trapa,Tableta,90 g,1.75,Dia,"Miel, caramelos y chocolate",2711
Chocolate con leche y galleta XXL  Jungly,Nestlé,Tableta,235 g,3.15,Dia,"Miel, caramelos y chocolate",2712
Tartaletas de chocolate rellenas de crema de cacahuete 2 unidades,Reeses's,Bolsa,42 g,1.25,Dia,"Miel, caramelos y chocolate",2713
Chocolate blanco y galleta  Jungly,Nestlé,Tableta,125 g,1.69,Dia,"Miel, caramelos y chocolate",2714
Barrita de chocolate con avellanas sin gluten ondulé,Dr. Schar,Bolsa,30 g,1.19,Dia,"Miel, caramelos y chocolate",2715
Chocolate negro 70% cacao con galleta belga,Valor,Tableta,200 g,2.8,Dia,"Miel, caramelos y chocolate",2716
Chocolate blanco,Huesitos,Tableta,125 g,1.85,Dia,"Miel, caramelos y chocolate",2717
Chocolate con leche y galleta,Huesitos,Tableta,125 g,1.85,Dia,"Miel, caramelos y chocolate",2718
Chocolate negro con almendras enteras  Dark,Nestlé,Tableta,150 g,2.69,Dia,"Miel, caramelos y chocolate",2719
Barquillos rellenos de chocolate,Doña delicia,Caja,150 g,1.29,Dia,"Miel, caramelos y chocolate",2720
Barquillos rellenos de vainilla,Doña delicia,Caja,150 g,1.29,Dia,"Miel, caramelos y chocolate",2721
Barritas de galleta y chocolate con leche  Extrafino pack,Nestlé,Tableta,108 g,1.39,Dia,"Miel, caramelos y chocolate",2722
Chocolate blanco con trozos de oreo,Milka,Tableta,100 g,1.55,Dia,"Miel, caramelos y chocolate",2723
Chocolatina rellena de grageas de cereales crispy,M&M's,Bolsa,31 g,1.1,Dia,"Miel, caramelos y chocolate",2724
Chocolate con leche relleno de cereales crispy,M&M's,Tableta,150 g,2.99,Dia,"Miel, caramelos y chocolate",2725
Chocolate negro 80% noir 0% azúcares,Trapa,Tableta,80 g,1.55,Dia,"Miel, caramelos y chocolate",2726
Chocolate negro 95% cacao,Trapa,Tableta,80 g,1.49,Dia,"Miel, caramelos y chocolate",2727
Chocolate 74% cacao con frambuesa,Trapa,Tableta,80 g,1.85,Dia,"Miel, caramelos y chocolate",2728
Chocolate con leche y cacahuete,M&M's,Tableta,165 g,2.99,Dia,"Miel, caramelos y chocolate",2729
Chocolate con leche con trozos de oreo,Milka,Tableta,3 x 100 g,3.9,Dia,"Miel, caramelos y chocolate",2730
Chocolate con leche,Milka,Tableta,3 x 100 g,3.4,Dia,"Miel, caramelos y chocolate",2731
Barrita de chocolate con leche  cacahuete y caramelo nutrageous,Reese's,Bolsa,47 g,1.6,Dia,"Miel, caramelos y chocolate",2732
Mini tarrinas de chocolate rellenas de crema de cacahuete,Reese's,Bolsa,90 g,2.35,Dia,"Miel, caramelos y chocolate",2733
Chocolate con leche y galleta  Jungly,Nestlé,Tableta,125 g,1.69,Dia,"Miel, caramelos y chocolate",2734
Chocolate con leche relleno strawberry cheesecake  MMMAX,Milka,Tableta,300 g,3.95,Dia,"Miel, caramelos y chocolate",2735
Chocolate negro 85% cacao  Dark,Nestlé,Tableta,120 g,2.39,Dia,"Miel, caramelos y chocolate",2736
Barritas de galleta recubiertas de chocolate,Kit Kat,Bolsa,3 x 41.5 g,2.19,Dia,"Miel, caramelos y chocolate",2737
Chocolate negro,Dolca,Tableta,100 g,1.05,Dia,"Miel, caramelos y chocolate",2738
Barrita rellena de caramelo con cacahuetes,Snickers,Tableta,50 g,1.39,Dia,"Miel, caramelos y chocolate",2739
Huevos de chocolate blanco relleno de leche y avellanas,Kinder,Bolsa,200 g,3.99,Dia,"Miel, caramelos y chocolate",2740
Chocolate negro 99% cacao  Excellence,Lindt,Tableta,50 g,3.29,Dia,"Miel, caramelos y chocolate",2741
Chocolate negro 92% cacao,Valor,Tableta,170 g,3.75,Dia,"Miel, caramelos y chocolate",2742
Grageas de chocolate con leche patrulla canina,Lacasitos,Bote,20 g,2.5,Dia,"Miel, caramelos y chocolate",2743
Chocolate blanco  Milkybar,Nestlé,Tableta,100 g,1.75,Dia,"Miel, caramelos y chocolate",2744
Bombones surtidos  Caja Roja,Nestlé,Caja,200 g,6.29,Dia,"Miel, caramelos y chocolate",2745
Chocolate negro 85% cacao sin azúcar añadido,Valor,Tableta,100 g,2.3,Dia,"Miel, caramelos y chocolate",2746
Barritas de galleta recubiertas de chocolate blanco,Kit Kat,Bolsa,125 g,2.25,Dia,"Miel, caramelos y chocolate",2747
Chocolate negro 70% cacao con pepitas de chocolate,Valor,Tableta,170 g,3.2,Dia,"Miel, caramelos y chocolate",2748
Chocolate blanco,Toblerone,Bolsa,100 g,2.09,Dia,"Miel, caramelos y chocolate",2749
Chocolate negro 74% cacao con pepitas de chocolate caramelizadas,Temptation de Dia,Tableta,100 g,1.45,Dia,"Miel, caramelos y chocolate",2750
Chocolate negro 74% cacao con naranja confitada,Temptation de Dia,Tableta,100 g,1.4,Dia,"Miel, caramelos y chocolate",2751
Chocolate con leche sin lactosa,Temptation de Dia,Tableta,100 g,1.55,Dia,"Miel, caramelos y chocolate",2752
Barritas de galleta recubiertas de chocolate negro 70%,Kit Kat,Bolsa,125 g,2.25,Dia,"Miel, caramelos y chocolate",2753
Chocolate negro 70% cacao,Nestlé,Tableta,120 g,2.05,Dia,"Miel, caramelos y chocolate",2754
Chocolate negro,Toblerone,Tableta,100 g,2.09,Dia,"Miel, caramelos y chocolate",2755
Chocolate negro 82% cacao ,Valor,Tableta,170 g,3.2,Dia,"Miel, caramelos y chocolate",2756
Chocolate con leche  Extrafino,Nestlé,Tableta,125 g,1.39,Dia,"Miel, caramelos y chocolate",2757
Barritas de barquillo recubierta de chocolate blanco,Huesitos,Bolsa,200 g,2.45,Dia,"Miel, caramelos y chocolate",2758
Chocolate blanco con lacasitos,Lacasitos,Tableta,100 g,1.69,Dia,"Miel, caramelos y chocolate",2759
Chocolate con leche con trozos de oreo,Milka,Tableta,300 g,3.75,Dia,"Miel, caramelos y chocolate",2760
Chocolate negro fondant para postres,Nestlé,Tableta,200 g,2.65,Dia,"Miel, caramelos y chocolate",2761
Chocolate con leche relleno de avellanas y caramelo  Extrafino,Nestlé,Tableta,87 g,1.25,Dia,"Miel, caramelos y chocolate",2762
Chocolate negro con almendras enteras,Valor,Tableta,250 g,4.84,Dia,"Miel, caramelos y chocolate",2763
Chocolate con leche y avellanas enteras,Milka,Tableta,100 g,1.55,Dia,"Miel, caramelos y chocolate",2764
Chocolate negro 70% cacao relleno con mousse de naranja,Valor,Tableta,150 g,2.99,Dia,"Miel, caramelos y chocolate",2765
Chocolate con leche,Valor,Tableta,300 g,3.7,Dia,"Miel, caramelos y chocolate",2766
Chocolate con leche y avellanas  Extrafino,Nestlé,Tableta,123 g,1.99,Dia,"Miel, caramelos y chocolate",2767
Chocolate puro,Valor,Tableta,300 g,3.8,Dia,"Miel, caramelos y chocolate",2768
Mini barritas de chocolate con leche y avellanas,Kinder,Bolsa,108 g,2.49,Dia,"Miel, caramelos y chocolate",2769
Barritas de galleta recubiertas de chocolate blanco,Kit Kat,Bolsa,42 g,1.29,Dia,"Miel, caramelos y chocolate",2770
Barritas de chocolate blanco y avellanas  Bueno,Kinder,Bolsa,39 g,1.29,Dia,"Miel, caramelos y chocolate",2771
Barritas de chocolate y caramelo 3 unidades,Mars,Bolsa,135 g,2.79,Dia,"Miel, caramelos y chocolate",2772
Barritas de chocolate con caramelo y cacahuetes 3 unidades,Snickers,Bolsa,150 g,2.79,Dia,"Miel, caramelos y chocolate",2773
Chocolate con leche con trozos de chips ahoy,Milka,Tableta,100 g,1.55,Dia,"Miel, caramelos y chocolate",2774
Chocolate con leche para postres,Nestlé,Tableta,170 g,2.69,Dia,"Miel, caramelos y chocolate",2775
Wafer de chocolate sin gluten,Proceli,Bolsa,100 g,3.65,Dia,"Miel, caramelos y chocolate",2776
Chocolate con leche y almendras  Extrafino,Nestlé,Tableta,123 g,1.99,Dia,"Miel, caramelos y chocolate",2777
Barritas de chocolate blanco rellenas de caramelo y galleta,Twix,Bolsa,46 g,1.39,Dia,"Miel, caramelos y chocolate",2778
Bombones surtidos  Caja Roja,Nestlé,Caja,100 g,3.35,Dia,"Miel, caramelos y chocolate",2779
Chocolate negro  Jungly,Nestlé,Tableta,125 g,1.69,Dia,"Miel, caramelos y chocolate",2780
Chocolate negro 70% cacao,Valor,Tableta,200 g,3.2,Dia,"Miel, caramelos y chocolate",2781
Barritas de barquillo recubierta de chocolate con leche,Huesitos,Bolsa,120 g,1.7,Dia,"Miel, caramelos y chocolate",2782
Barrita de chocolate y caramelo,Mars,Bolsa,51 g,1.39,Dia,"Miel, caramelos y chocolate",2783
Barritas de galleta recubiertas de chocolate con leche,Kit Kat,Bolsa,41.5 g,1.29,Dia,"Miel, caramelos y chocolate",2784
Chocolate negro,Temptation de Dia,Tableta,100 g,0.75,Dia,"Miel, caramelos y chocolate",2785
Chocolate con leche con trozos de oreo,Milka,Tableta,100 g,1.55,Dia,"Miel, caramelos y chocolate",2786
Chocolate blanco para postres,Nestlé,Tableta,170 g,2.29,Dia,"Miel, caramelos y chocolate",2787
Chocolate negro 70% cacao sin azúcar,Valor,Tableta,125 g,1.99,Dia,"Miel, caramelos y chocolate",2788
Chocolate puro con almendras sin azúcar,Valor,Tableta,150 g,3.25,Dia,"Miel, caramelos y chocolate",2789
Barritas de chocolate blanco y avellanas,Kinder,Bolsa,3 x 39 g,2.99,Dia,"Miel, caramelos y chocolate",2790
Cacahuetes cubiertos de chocolate,Conguitos,Bolsa,220 g,3.35,Dia,"Miel, caramelos y chocolate",2791
Grageas de chocolate con leche,Lacasitos,Bolsa,190 g,3.49,Dia,"Miel, caramelos y chocolate",2792
Chocolate negro 85% cacao  Excellence,Lindt,Tableta,100 g,3.15,Dia,"Miel, caramelos y chocolate",2793
Chocolate con leche con almendras enteras,Valor,Tableta,250 g,3.9,Dia,"Miel, caramelos y chocolate",2794
Grageas de chocolate con leche,M&M's,Bolsa,200 g,3.59,Dia,"Miel, caramelos y chocolate",2795
Chocolate con leche  blanco y negro triolade,Milka,Tableta,280 g,3.75,Dia,"Miel, caramelos y chocolate",2796
Huevos de chocolate relleno de leche y avellanas,Kinder,Bolsa,125 g,2.99,Dia,"Miel, caramelos y chocolate",2797
Chocolate con leche relleno de galleta choco-swing,Milka,Tableta,300 g,3.5,Dia,"Miel, caramelos y chocolate",2798
Cacahuete recubierto de chocolate con leche,M&M's,Bolsa,45 g,1.39,Dia,"Miel, caramelos y chocolate",2799
Chocolate con leche con cereales  Crunch,Nestlé,Tableta,100 g,1.73,Dia,"Miel, caramelos y chocolate",2800
Grageas de chocolate con leche,Lacasitos,Bolsa,80 g,2.79,Dia,"Miel, caramelos y chocolate",2801
Chocolate con leche relleno de lacasitos,Lacasitos,Tableta,100 g,1.69,Dia,"Miel, caramelos y chocolate",2802
Cacahuete recubierto de chocolate con leche,M&M's,Bolsa,200 g,3.59,Dia,"Miel, caramelos y chocolate",2803
Caramelos de chocolate,Toffiffe,Caja,125 g,2.19,Dia,"Miel, caramelos y chocolate",2804
Chocolate para hacer a la taza,Valor,Tableta,300 g,3.2,Dia,"Miel, caramelos y chocolate",2805
Chocolate con leche sin azúcares añadidos,Temptation de Dia,Tableta,100 g,1.15,Dia,"Miel, caramelos y chocolate",2806
Huevos de chocolate con sorpresa,Kinder,Blister,3 x 20 g,3.59,Dia,"Miel, caramelos y chocolate",2807
Chocolate con leche y almendras troceadas,Milka,Tableta,125 g,2.09,Dia,"Miel, caramelos y chocolate",2808
Chocolate puro con almendras enteras,Valor,Tableta,250 g,3.9,Dia,"Miel, caramelos y chocolate",2809
Chocolate con leche y almendras enteras 0% azúcares,Valor,Tableta,150 g,3.25,Dia,"Miel, caramelos y chocolate",2810
Barritas de chocolate con leche y avellanas,Kinder,Bolsa,3 x 43 g,2.99,Dia,"Miel, caramelos y chocolate",2811
Cacahuete recubierto de chocolate con leche,M&M's,Bolsa,400 g,5.99,Dia,"Miel, caramelos y chocolate",2812
Sopa de pollo  con fideos finos,Gallina Blanca,Sobre,71 g,0.85,Mercadona,Pizzas y platos preparados,2813
Sopa de pollo  con fideos finos,Hacendado,Sobre,2 sobres x 80 g,1.0,Mercadona,Pizzas y platos preparados,2814
Sopa de cebolla,Hacendado,Sobre,2 sobres x 50 g,1.3,Mercadona,Pizzas y platos preparados,2815
Sopa maravilla,Hacendado,Sobre,85 g,0.65,Mercadona,Pizzas y platos preparados,2816
Tallarines Formaggio  salsa cremosa de queso,Hacendado,Sobre,190 g,1.3,Mercadona,Pizzas y platos preparados,2817
Sopa de miso,Hacendado,Paquete,3 ud.,2.25,Mercadona,Pizzas y platos preparados,2818
Sopa de verduras,Gallina Blanca,Sobre,51 g,0.85,Mercadona,Pizzas y platos preparados,2819
Caldo de pollo,Hacendado,Brick,1 L,0.8,Mercadona,Pizzas y platos preparados,2820
Caldo de pollo casero,Gallina Blanca,Brick,1 L,2.2,Mercadona,Pizzas y platos preparados,2821
Caldo de pescado,Hacendado,Brick,1 L,1.15,Mercadona,Pizzas y platos preparados,2822
Caldo de cocido casero,Gallina Blanca,Brick,1 L,2.2,Mercadona,Pizzas y platos preparados,2823
Caldo de verduras,Hacendado,Brick,1 L,1.0,Mercadona,Pizzas y platos preparados,2824
Caldo de marisco o fideuá para paella  con sofrito,Hacendado,Brick,1 L,2.1,Mercadona,Pizzas y platos preparados,2825
Caldo de pollo  bajo en sal,Hacendado,Brick,1 L,1.2,Mercadona,Pizzas y platos preparados,2826
Caldo para paella de carne  con sofrito,Hacendado,Brick,1 L,2.25,Mercadona,Pizzas y platos preparados,2827
Caldo de cocido,Hacendado,Brick,1 L,0.9,Mercadona,Pizzas y platos preparados,2828
Caldo de carne  en pastillas,Hacendado,Caja,12 ud. (120 g),0.85,Mercadona,Pizzas y platos preparados,2829
Caldo de pollo  en pastillas,Avecrem,Caja,24 ud. (240 g),2.95,Mercadona,Pizzas y platos preparados,2830
Caldo de pescado  en pastillas,Hacendado,Caja,12 ud. (120 g),0.85,Mercadona,Pizzas y platos preparados,2831
Doble caldo sabor clásico carne  en pastillas,Knorr,Caja,16 ud. (160 g),1.65,Mercadona,Pizzas y platos preparados,2832
Caldo de pollo  en pastillas,Hacendado,Caja,24 ud. (240 g),1.4,Mercadona,Pizzas y platos preparados,2833
Caldo de verduras  en pastillas,Hacendado,Caja,12 ud. (120 g),0.85,Mercadona,Pizzas y platos preparados,2834
Tomate triturado,Hacendado,Bote,800 g,0.98,Mercadona,"Conservas, caldos y cremas",2835
Tomate triturado,Hacendado,Bote,400 g,0.72,Mercadona,"Conservas, caldos y cremas",2836
Tomate frito,Hacendado,Brick,3 bricks x 400 g,1.4,Mercadona,"Conservas, caldos y cremas",2837
Tomate frito,Hacendado,Brick,3 mini bricks x 210 g,1.0,Mercadona,"Conservas, caldos y cremas",2838
Tomate frito,Hacendado,Tarro,560 g,0.85,Mercadona,"Conservas, caldos y cremas",2839
Tomate frito receta artesana,Hacendado,Tarro,560 g,2.4,Mercadona,"Conservas, caldos y cremas",2840
Tomate frito receta artesana,Hacendado,Tarro,300 g,1.65,Mercadona,"Conservas, caldos y cremas",2841
Tomate frito estilo casero,Hacendado,Brick,380 g,1.3,Mercadona,"Conservas, caldos y cremas",2842
Tomate troceado pelado,Hacendado,Bote,410 g,0.85,Mercadona,"Conservas, caldos y cremas",2843
Tomate frito,Hida,Bote,400 g,1.75,Mercadona,"Conservas, caldos y cremas",2844
Fritada pisto,Hacendado,Brick,380 g,1.4,Mercadona,"Conservas, caldos y cremas",2845
Tomate entero pelado,Hacendado,Bote,800 g (480 g escurrido),1.4,Mercadona,"Conservas, caldos y cremas",2846
Tomate entero pelado,Hacendado,Bote,400 g (240 g escurrido),0.8,Mercadona,"Conservas, caldos y cremas",2847
Tomate frito  con aceite de oliva,Hacendado,Brick,3 mini bricks x 210 g,1.4,Mercadona,"Conservas, caldos y cremas",2848
Tomate frito sin azúcares añadidos,Hacendado,Tarro,560 g,1.1,Mercadona,"Conservas, caldos y cremas",2849
Tomate doble concentrado  extra,Hacendado,Bote,170 g,1.0,Mercadona,"Conservas, caldos y cremas",2850
Tomate para untar  con aceite de oliva,Hacendado,Tarro,2 tarritos x 160 g,1.65,Mercadona,"Conservas, caldos y cremas",2851
Tomate tamizado sin piel,Hacendado,Brick,390 g,0.9,Mercadona,"Conservas, caldos y cremas",2852
Tomate seco  en aceite de oliva,Hacendado,Tarro,190 g,2.3,Mercadona,"Conservas, caldos y cremas",2853
Recambio de toallitas húmedas,Planeta Bebé de Dia,Bolsa,80 unidades,1.15,Dia,Higiene,2854
Toallitas húmedas,Planeta Bebé de Dia,Bolsa,3 x 80 unidades,3.3,Dia,Higiene,2855
Toallitas para bebés con piel atópica,Planeta Bebé de Dia,Bolsa,64 unidades,1.85,Dia,Higiene,2856
Toallitas para bebés cremosas,Planeta Bebé de Dia,Bolsa,48 unidades,1.2,Dia,Higiene,2857
Pañales 13-20 kgs talla 5 ,Planeta Bebé de Dia,Bolsa,80 unidades,15.2,Dia,Higiene,2858
Pañales 17-28 kgs talla 6 ,Planeta Bebé de Dia,Bolsa,28 unidades,8.02,Dia,Higiene,2859
Pañales 8-15 kgs talla 4 ,Planeta Bebé de Dia,Bolsa,88 unidades,14.65,Dia,Higiene,2860
Toallitas para bebés,Dodot,Bolsa,64 unidades,1.75,Dia,Higiene,2861
Pañales 13-20 kgs talla 5 ,Planeta Bebé de Dia,Bolsa,40 unidades,7.7,Dia,Higiene,2862
Pañales 8-15 kgs talla 4 ,Planeta Bebé de Dia,Bolsa,44 unidades,7.15,Dia,Higiene,2863
Pañales 11-16 kg talla 5,Dodot,Bolsa,54 unidades,19.49,Dia,Higiene,2864
Pañales 2-5 kgs talla 1,Planeta Bebé de Dia,Bolsa,50 unidades,4.05,Dia,Higiene,2865
Pañales 4-9 kgs talla 3,Planeta Bebé de Dia,Bolsa,24 unidades,7.9,Dia,Higiene,2866
Toallitas aqua,Planeta Bebé de Dia,Bolsa,60 unidades,1.8,Dia,Higiene,2867
Pañales 4-9 kgs talla 3,Planeta Bebé de Dia,Bolsa,102 unidades,15.0,Dia,Higiene,2868
Pañales 13-20 kg talla L   ,Planeta Bebé de Dia,Bolsa,20 unidades,6.25,Dia,Higiene,2869
Toallitas para bebés aqua pure,Dodot,Bolsa,3 x 48 unidades,10.29,Dia,Higiene,2870
Pañales 15-25 kg talla XL,Planeta Bebé de Dia,Bolsa,18 unidades,6.99,Dia,Higiene,2871
Calzoncillos absorbentes para niños de 4 a 7 años,Huggies DryNites  ,Bolsa,10 unidades,8.99,Dia,Higiene,2872
Pañales 13-19 kg talla 6,Dodot,Bolsa,36 unidades,14.59,Dia,Higiene,2873
Pañales 4-8 kg talla 2 recién nacido,Dodot,Bolsa,58 unidades,19.99,Dia,Higiene,2874
Toallitas de higiene íntima,Imaqe de Dia,Bolsa,20 unidades,1.1,Dia,Higiene,2875
Toallitas de higiene corporal para adultos,Botikit de Dia,Bolsa,60 unidades,3.99,Dia,Higiene,2876
Cambiador infantil,Planeta Bebé de Dia,Bolsa,10 unidades,4.2,Dia,Higiene,2877
Pañales 9-14 kg talla 4   ,Dodot,Bolsa,58 unidades,19.49,Dia,Higiene,2878
Pañales recién 2-5 kgs talla 1 recién nacido,Dodot,Bolsa,44 unidades,14.99,Dia,Higiene,2879
Pañales 3-6 kgs talla 2   ,Planeta Bebé de Dia,Bolsa,40 unidades,5.99,Dia,Higiene,2880
Pañales + 15 kg talla 6   ,Dodot,Bolsa,27 unidades,12.99,Dia,Higiene,2881
Pañales 12-17 kg talla 5   ,Dodot,Bolsa,30 unidades,12.99,Dia,Higiene,2882
Pañal de noche 35-50 kg talla L   ,Planeta Junior de Dia,Bolsa,12 unidades,8.5,Dia,Higiene,2883
Bañador desechable 13-20 kg talla M   ,Planeta Bebé de Dia,Bolsa,6 unidades,2.95,Dia,Higiene,2884
Bañador desechable 8-15 kg talla S   ,Planeta Bebé de Dia,Bolsa,6 unidades,2.95,Dia,Higiene,2885
Pañales 8-15 kg talla M   ,Planeta Bebé de Dia,Bolsa,22 unidades,6.19,Dia,Higiene,2886
Toallitas para bebés aqua pure,Dodot,Bolsa,48 unidades,3.49,Dia,Higiene,2887
Calzoncillos absorbentes de noche para niños de 8 a 15 años DryNites ,Huggies DryNites  ,Bolsa,9 unidades,8.99,Dia,Higiene,2888
Crema solar facial anti edad spf,Imaqe de Dia,Tubo,50+   50 ml,5.29,Dia,Higiene,2889
Bruma solar infantil spf,Imaqe de Dia,Spray,50+   200 ml,6.69,Dia,Higiene,2890
Crema solar infantil spf,Imaqe de Dia,Tubo,50+   75 ml,3.99,Dia,Higiene,2891
Protector solar spf,Imaqe de Dia,Bote,50+   250 ml,6.99,Dia,Higiene,2892
Protector solar sensitive spf,Imaqe de Dia,Bote,50+   250 ml,6.99,Dia,Higiene,2893
Bruma solar spf,Imaqe de Dia,Spray,50+   200 ml,6.69,Dia,Higiene,2894
Crema solar facial bb tono medio spf,Imaqe de Dia,Tubo,50+   50 ml,5.29,Dia,Higiene,2895
Crema solar facial con filtro mineral spf,Imaqe de Dia,Tubo,50   50 ml,5.99,Dia,Higiene,2896
Protector solar infantil spf,Imaqe de Dia,Bote,50+   250 ml,7.5,Dia,Higiene,2897
Crema solar facial spf,Imaqe de Dia,Tubo,50+   50 ml,5.29,Dia,Higiene,2898
Aceite solar tacto seco con acelerador spf,Imaqe de Dia,Bote,15   250 ml,4.89,Dia,Higiene,2899
Gel aftersun con aloe vera ecológico,Imaqe de Dia,Bote,250 ml,3.19,Dia,Higiene,2900
Leche solar spf,Imaqe de Dia,Bote,30   250 ml,4.99,Dia,Higiene,2901
Aftersun loción prolongador del bronceado,Imaqe de Dia,Bote,400 ml,2.79,Dia,Higiene,2902
Crema facial solar spf,Nivea,Tubo,50   50 ml,12.95,Dia,Higiene,2903
Leche solar spf,Imaqe de Dia,Bote,50+   250 ml,6.99,Dia,Higiene,2904
Aftersun leche hidratante reparadora,Ecran,Botella,400 ml,6.99,Dia,Higiene,2905
Protector solar facial antimanchas con vitamina C spf,Delial,Bote,50+   40 ml,14.99,Dia,Higiene,2906
Protector solar facial spf,Nivea,Paquete,50  50 ml,11.99,Dia,Higiene,2907
Protector solar capilar,Imaqe de Dia,Spray,200 ml,2.99,Dia,Higiene,2908
Spray protector solar spf,Delial,Bote,30   300 ml,11.95,Dia,Higiene,2909
