producto,marca,formato,cantidad,precio,supermercado
Regaliz rojo torcidas,Marcelo Caramelo de Dia,Bolsa,225 g,"1,09 €",Dia
Regaliz relleno pica pica,Marcelo Caramelo de Dia,Bolsa,225 g,"1,09 €",Dia
Chicles sabor hierbabuena sin azúcar,Iceberg de Dia,Bolsa,44.8 g,"0,99 €",Dia
Chicles de hierbabuena sin azúcar,Iceberg de Dia,Bote,70 unidades,"1,99 €",Dia
Caramelo de goma relleno sabor cereza  Pikotas,Dulciora,Bolsa,100 g,"1,39 €",Dia
Golosinas fresa,Marcelo Caramelo de Dia,Bolsa,250 g,"1,69 €",Dia
Nubes,Marcelo Caramelo de Dia,Bolsa,200 g,"1,27 €",Dia
Golosinas sandía,Trolli,Bolsa,100 g,"1,09 €",Dia
masticables de frutas,Palotes,Bolsa,90 g,"1,05 €",Dia
Regaliz rueda rojo,Marcelo Caramelo de Dia,Bolsa,250 g,"1,39 €",Dia
Regaliz negro torcidas,Marcelo Caramelo de Dia,Bolsa,225 g,"1,09 €",Dia
Mini regalices sour boom colour mix,Fini,Bolsa,90 g,"1,19 €",Dia
Golosinas surtidas,Marcelo Caramelo de Dia,Bolsa,250 g,"1,79 €",Dia
Golosinas ositos azucarados,Marcelo Caramelo de Dia,Bolsa,250 g,"1,59 €",Dia
Chicles sabor menta fuerte sin azúcar,Iceberg de Dia,Bolsa,44.8 g,"0,99 €",Dia
Chicles de fresa sin azúcar,Iceberg de Dia,Bote,70 unidades,"1,99 €",Dia
Caramelos de menta sin azúcar,Sweets&sugar,Bolsa,100 g,"1,00 €",Dia
Golosinas gatos sabor regaliz,Trolli,Bolsa,100 g,"1,05 €",Dia
Golosinas cintas pica,Marcelo Caramelo de Dia,Tarrina,300 g,"1,75 €",Dia
Nubes rellenas,Fini,Bolsa,80 g,"1,19 €",Dia
Golosinas surtidas little mix,Fini,Tarrina,500 g,"3,79 €",Dia
Caramelos con  varios sabores  bolsa,Chupa Chups,Palo,208 g,"3,20 €",Dia
Caramelos clásicos de nata sin azúcar,Werther's,Bolsa,90 g,"2,39 €",Dia
Chicles sabor menta sin azúcar,Orbit,Bolsa,5 unidades,"3,69 €",Dia
Chicles sabor hierbabuena sin azúcar,Orbit,Bolsa,5 unidades,"3,69 €",Dia
Chicles sabor eucalipto sin azúcar,Orbit,Bolsa,5 unidades,"3,69 €",Dia
Chicles sabor fresa sin azúcar,Orbit,Bolsa,5 unidades,"3,69 €",Dia
Caramelos sabor mentol y limón,Iceberg de Dia,Bolsa,300 g,"2,19 €",Dia
Caramelo con  varios sabores,Chupa Chups,Palo,1 unidad,"0,49 €",Dia
Caramelos de nata,Werther's,Bolsa,135 g,"1,99 €",Dia
Golosinas berries,Haribo,Bolsa,150 g,"1,99 €",Dia
Chicles sabor mentol fuerte sin azúcar,Orbit,Bote,60 unidades,"3,99 €",Dia
Caramelos sabor fresa con vitamina C,Smint,Caja,49 g,"2,79 €",Dia
Caramelos masticables dipper ball,Vidal,Bolsa,70 g,"1,00 €",Dia
Golosinas red noodles,Damel,Bolsa,200 g,"1,29 €",Dia
Caramelos masticables sabor a frutas,Marcelo Caramelo de Dia,Bolsa,300 g,"1,49 €",Dia
Chicles de melón,Migueláñez,Bolsa,125 g,"1,95 €",Dia
Golosinas tropical mix,Vidal,Bolsa,180 g,"2,25 €",Dia
Golosinas favoritos fusión,Haribo,Bolsa,150 g,"1,99 €",Dia
Golosinas funiverse mix,Trolli,Bolsa,100 g,"1,09 €",Dia
Caramelos de jengibre sin azúcar,Sweets&sugar,Bolsa,100 g,"1,25 €",Dia
Golosinas smoo free koala,Fini,Bolsa,165 g,"2,25 €",Dia
Caramelos rellenos de miel,Villa,Bolsa,100 g,"0,75 €",Dia
Regaliz negro mega torcidas,Haribo,Bolsa,160 g,"1,99 €",Dia
Golosinas mini mix,Vidal,Bolsa,75 g,"1,09 €",Dia
Golosinas fresas rellenas,Vidal,Bolsa,180 g,"2,25 €",Dia
Regaliz sabor nata fresa,Fini,Caja,290 g,"2,99 €",Dia
Golosinas booster bits fruit,Fini,Bolsa,90 g,"1,00 €",Dia
Caramelo con  play xxl,Chupa Chups,Palo,1 unidad,"0,75 €",Dia
Sour lenguas,Chupa Chups,Bolsa,145 g,"2,35 €",Dia
Caramelo comprimido,Pez,Blister,26 g,"1,99 €",Dia
Regaliz rojo surtido sensation red mix,Fini,Bolsa,165 g,"2,19 €",Dia
Golosinas besos de fresa,Trolli,Bolsa,100 g,"1,09 €",Dia
Golosinas pulpos pica pica,Trolli,Bolsa,100 g,"1,09 €",Dia
Chicles sabor menta 60 minutos,Trident,Bolsa,39.6 g,"1,69 €",Dia
Chicles sabor hierbabuena 60 minutos,Trident,Bolsa,39.6 g,"1,69 €",Dia
Gominolas surtidas veganas con azúcar,Damel,Bolsa,125 g,"1,29 €",Dia
Gominolas surtidas veganas brillo,Damel,Bolsa,125 g,"1,29 €",Dia
Golosinas dinorex,Trolli,Bolsa,100 g,"1,09 €",Dia
Chicles sabor menta sin azúcar,Trident,Bolsa,44 g,"1,39 €",Dia
Caramelos con  flavour playlist xxl  bolsa,Chupa Chups,Palo,145 g,"3,65 €",Dia
Golosinas torcidas rellenas de pica pica,Fini,Bolsa,165 g,"2,09 €",Dia
Golosinas sour boom mix,Fini,Bolsa,165 g,"2,15 €",Dia
Surtido de golosinas en mini bolsitas,Marcelo Caramelo de Dia,Bolsa,280 g,"2,35 €",Dia
Caramelos de limón y miel,Mentolin,Bolsa,100 g,"1,29 €",Dia
Caramelos surtidos sabor frutas,Pictolin,Bolsa,480 g,"2,99 €",Dia
Chicles sabor sandí­a sin azúcar,Iceberg de Dia,Bolsa,44.8 g,"0,99 €",Dia
Chicles sabor fresa sin azúcar,Iceberg de Dia,Bolsa,44.8 g,"0,99 €",Dia
Golosinas pop eye,Trolli,Bolsa,75 g,"1,79 €",Dia
Chicle sabor fresa maxiroll,Boomer,Caja,56 g,"2,79 €",Dia
Roll frutas pack caramelos masticables sabor frutas   bolsa,Mentos,Paquete,2 x 38 g,"1,99 €",Dia
Chicles sabor fresa,Bubbaloo,Bolsa,38 g,"1,19 €",Dia
Golosinas jelly  Gummys,Dulciora,Bolsa,100 g,"1,69 €",Dia
Cono chuches celebración sin gluten,Midel,Bolsa,1 unidad,"1,25 €",Dia
Caramelos de limón y melisa,Mentolin,Caja,20 g,"1,05 €",Dia
Caramelos sabor café expresso,Solano,Bolsa,99 g,"3,49 €",Dia
Caramelos masticables fruit mix,Mentos,Bolsa,160 g,"2,70 €",Dia
Chicles sabor sandía sin azúcar,Trident,Caja,23 g,"1,39 €",Dia
Chicles sabor hierbabuena sin azúcar,Trident,Caja,23 g,"1,19 €",Dia
Caramelos tradicionales,Solano,Bolsa,99 g,"3,49 €",Dia
Polos para conar sin azúcar  bolsa,Kelia,Gel,540 ml,"1,60 €",Dia
Golosinas favoritos classic,Haribo,Bolsa,150 g,"1,99 €",Dia
Regaliz de goma torcidas rellenas,Fini,Bolsa,125 g,"1,09 €",Dia
Golosinas mini burger,Trolli,Bolsa,50 g,"1,19 €",Dia
Golosinas smile kit,Fini,Bolsa,90 g,"1,00 €",Dia
Golosinas de fresas con nata,Fini,Bolsa,75 g,"1,05 €",Dia
Caramelos de frutos rojos sin azúcar,Smint,Lata,35 g,"2,35 €",Dia
Golosinas pica mix,Marcelo Caramelo de Dia,Bolsa,200 g,"1,69 €",Dia
Golosinas mega torcidas sabor fresa,Haribo,Bolsa,160 g,"1,99 €",Dia
Caramelos clásicos de toffee con chocolate,Werther's,Bolsa,120 g,"2,15 €",Dia
Golosinas mega-roulette,Haribo,Bolsa,45 g,"1,09 €",Dia
Golosinas beans,Fini,Bolsa,165 g,"1,89 €",Dia
Chicles sabor bubblemint sin azúcar,Orbit,Bote,84 g,"3,99 €",Dia
Chicles sabor hierbabuena 60 minutos,Trident,Bote,68.2 g,"3,49 €",Dia
Golosinas de regaliz black edition,Haribo,Bolsa,150 g,"1,99 €",Dia
Golosinas favoritos pica,Haribo,Bolsa,150 g,"1,99 €",Dia
Caramelos masticables sabor fruta,Skittles,Bolsa,174 g,"3,35 €",Dia
Caramelos masticables sabor fruta ácida,Skittles,Bolsa,174 g,"3,35 €",Dia
Golosinas jelly cola,Fini,Bolsa,100 g,"1,15 €",Dia
Golosinas selection mix,Fini,Bolsa,150 g,"1,89 €",Dia
Golosinas ositos de oro,Haribo,Bolsa,150 g,"1,99 €",Dia
Golosinas funky mix,Haribo,Bolsa,150 g,"1,99 €",Dia
Golosinas favoritos red&white,Haribo,Bolsa,150 g,"1,99 €",Dia
Caramelos de limón y mentol,Respiral,Bolsa,150 g,"1,95 €",Dia
Bolsa de golosinas happy party,Fini,Bolsa,250 g,"2,69 €",Dia
Mini caramelos con  varios sabores  bolsa,Chupa Chups,Palo,120 g,"2,54 €",Dia
Golosinas sugar shuffle,Fini,Bolsa,165 g,"1,69 €",Dia
Caramelos de limón sin azúcar,Smint,Lata,35 g,"2,35 €",Dia
Pastillas de menta sin azúcar,Smint,Caja,8 g,"1,95 €",Dia
Chicles sabor hierbabuena sin azúcar,Trident,Bolsa,43 g,"1,39 €",Dia
Chicles sabor bubblemint sin azúcar,Orbit,Bolsa,5 unidades,"2,39 €",Dia
Caramelos sabor menta extra fuerte,Halls,Bolsa,2 x 32 g,"1,99 €",Dia
Caramelo con  de fresa melody pops,Chupa Chups,Palo,1 unidad,"1,00 €",Dia
Chicles sabor menta sin azúcar,Orbit,Bote,60 unidades,"3,99 €",Dia
Chicles sabor eucalipto sin azúcar,Orbit,Bote,60 unidades,"3,99 €",Dia
Chicles sabor hierbabuena sin azúcar,Orbit,Bote,60 unidades,"3,99 €",Dia
Chicles sabor fresa sin azúcar,Orbit,Bote,60 unidades,"3,99 €",Dia
Chicles sabor fresa sin azúcar,Trident,Bolsa,43 g,"1,39 €",Dia
Chicles sabor menta sin azúcar,Trident,Bolsa,43 g,"1,39 €",Dia
Tronquitos sin pica,Marcelo Caramelo de Dia,Bolsa,225 g,"1,09 €",Dia
Caramelos de eucalipto y menta,Iceberg de Dia,Bolsa,300 g,"2,19 €",Dia
Golosinas lágrimas,Marcelo Caramelo de Dia,Bolsa,250 g,"1,59 €",Dia
Golosinas mora,Marcelo Caramelo de Dia,Bolsa,250 g,"1,44 €",Dia
Golosinas favoritos,Haribo,Bolsa,150 g,"1,99 €",Dia
Golosinas starmix,Haribo,Bolsa,150 g,"1,99 €",Dia
Golosinas tropifrutti,Haribo,Bolsa,150 g,"1,99 €",Dia
Caramelos de eucalipto y mentol,Respiral,Bolsa,150 g,"1,95 €",Dia
Caramelos de eucalipto sin azúcar,Smint,Lata,35 g,"2,35 €",Dia
Caramelos de eucalipto sin azúcar,Pictolin,Bolsa,200 g,"2,35 €",Dia
Caramelos de eucalipto,Pictolin,Bolsa,300 g,"2,59 €",Dia
Golosinas gusanos ácidos,Trolli,Bolsa,100 g,"1,09 €",Dia
Caramelos sabor miel y limón,Halls,Bolsa,2 x 32 g,"1,99 €",Dia
Caramelos sabor cítricos,Halls,Bolsa,2 x 32 g,"1,99 €",Dia
Caramelos sabor eucalipto,Halls,Bolsa,2 x 32 g,"1,99 €",Dia
Caramelos de fresa sin azúcar,Smint,Lata,35 g,"2,35 €",Dia
Regaliz rojo relleno,Fini,Tarrina,290 g,"2,99 €",Dia
Caramelos de menta fresca,Lacasa,Bolsa,250 g,"2,59 €",Dia
Polo refrescante mix para conar  bolsa,Marcelo Caramelo de Dia,Gel,600 ml,"1,45 €",Dia
Chicle grageas sabor menta fuerte,Orbit,Bolsa,5 unidades,"3,69 €",Dia
Caramelos masticables de frutas,Sugus,Bolsa,150 g,"2,99 €",Dia
